ID;Question;Answer;Justification;Guide to Answering;Reviewer 1 Comments;Reviewer 2 Comments;Mark Question;Score
41;"Is the use of open data in your country having an impact on the efficiency and effectiveness of the government (at any level) in delivering public services? 

For justification:
* If yes, please explain how and what kind of impact is created on the topic and provide examples of maximum 3 recent open data reuse cases in the form of research or application, whether developed by government or by civil society.";yes;"Control of sales or leasing of communal property: In order to transfer an object for rent, it must first be included in the lists of state or communal property of type I or II. The property must be entered in a single register in order to provide all citizens with access to information and to provide equal conditions for participation in the competition for property lease. In particular, the I-type list contains property objects that are transferred for use through an auction, the II-type list — those that are transferred without an auction to budget organizations. In addition to the norm regarding the implementation of the relevant law and the obligation to use the Prozoro.Prodazhi platform, local self-government bodies must publish this information in the form of open data. Resolution of the CMU No. 835 contains the following mandatory sets: ""List of communal property objects that have been leased or other right of use"", ""List of communal property objects that can be leased"". For example, the data set ""List of unused property objects (premises) of communal ownership that can be transferred to the use of the Chopska City Council"" contains the following information: purpose of the property, rental rate, lease term, information about the object, information about lessor, EDRPOU code, location (According to the latest study Social and anti-corruption impact of open data on local comunities (part 2) https://tapas.org.ua/wp-content/uploads/2022/07/OD_municipalities_part-2.pdf ) Interactive map of the register of communal property of Ternopil https://ternopilcity.gov.ua/municipal-data-map/interaktivna-karta-reestru-komunalnogo-mayna/ 
The interactive map of the register of communal property is a system of recording and displaying information about communal 
property of the Ternopil City Council. The idea of the project arose in 2018. It turned out that some premises allocated for public organizations actually serve as offices for pro-government political parties that do not pay the appropriate amount for their rent. Or the building does not function at all, is idle and does not benefit the city. This discovery was the impetus for the creation of a municipal property monitoring service in the city. Then the government, business (IT companies) and the public sector of Ternopil came together to digitize, process and verify information about the property and, ultimately, create an interactive map. The service uses two sets of open data: ""Register of Loan Agreements (free use) of communal property"" and ""Register of Lease Agreements of Communal Property"" of the Ternopil City Territorial Community.";;;;;15
42;"Is the use of open data in your country having an impact on transparency and accountability of public administrations?

For justification:
* If yes, please explain how and what kind of impact is created on the topic and provide examples of maximum 3 recent open data reuse cases in the form of research or application, whether developed by government or by civil society.";yes;"Open Data Watchdog https://wd.clarity-project.info/ is a service that allows you to track events with datasets on the Unified State Open Data Portal. It is designed to contribute to increasing the level of transparency of managers and administrators responsible for the release of data and to reducing abuses on their part.
An important feature of the Open Data Watchdog service is that you can find out more information about datasets, in particular, about their addition or removal, changes and editing. It is enough to make a few clicks to get the necessary information.
The chatbot of the https://t.me/datagovua_watchdog service will also help monitor changes with open data sets.
Monitoring the addition and removal of data sets will be of interest not only to a narrow circle of individuals, such as portal administrators, managers, experts and activists in the field of open data, but also to ordinary citizens. In Ukraine, there are more than 10,000 administrators who publish and withdraw sets of open data. Such sets can be both national (for example, in 2022, a set with financial statements for 2021 was removed from the portal, which was then published again), and local.
Using the Open Data Watchdog, local activists, mass media, and the public will be able to monitor and control not only changes in open data sets, but also what consequences this has for the state and communities. Having such information, everyone can, for example, with the help of requests and appeals, influence the openness of authorities and their decisions.";;;;;15
43;"Is the use of open data in your country having an impact on policy-making processes (i.e. are public administrations making use of the data as evidence for the problem identification and policy formulation)? 

For justification:
* If yes, please explain how and what kind of impact is created on the topic and provide examples of maximum 3 recent open data reuse cases in the form of research or application, whether developed by government or by civil society.";yes;"Standardization of data and automation of their processing have simplified the process of planning measures of state supervision and control and made it less time-consuming, ie reduced the time spent on the preparation of inspection plans.
Prior to the introduction of automated open data collection, the general process of planning state supervision and control measures took months. Only the construction of territorial plans by the central office of state supervision and control took several weeks and required the work of a separate department.
Currently, this process is automated, which saves about 2,400 hours per year FTE.The openness of inspection data has also made information more accessible within state oversight and control bodies. The main results of the inspection, including scanned copies of documents, are now available online. In case of response to the information request, employees may provide copies of documents or links to them. To respond to a complaint, they have more time to prepare a quality response.                                                                                                                                                                                                                                                                                                                                                                             Internet Subvensions project. The purpose of the project Internet Subventions (https://bb.gov.ua/)  is to provide a technical opportunity for 1.5 million Ukrainians to connect to the optical Internet for the first time, connecting 6,000 educational, medical and cultural institutions to the optical Internet. For the first time the government will  cover 3,000 Ukrainian villages with optical networks . The Ministry of the Digital transformation uses open and shared data for the creation of the dashboard which allows for citizens to monitor the coverage of the  optical networks in Ukrainan villages and monitor the applications from heads of the communities for receiving government subvention. Using open data on  the coverage of the  optical networks, the Ministry outlined the current problem, created a new program to solve the problem  and checked the correctness of the data included in the applications. 
Project http://bit.ly/subvention-dashboard ";;;;;15
44;"Is the use of open data in your country having an impact on decision-making processes (i.e. are public administrations making use of the data as evidence to be included in their daily operations)?

For justification:
* If yes, please explain how and what kind of impact is created on the topic and provide examples of maximum 3 recent open data reuse cases in the form of research or application, whether developed by government or by civil society.";yes;"BOOST is a tool for analyzing budget indicators, implemented by the Ministry of Finance of Ukraine on the portal openbudget, developed on the basis of the methodology of the World Bank. The purpose of the tool is to use budget funds efficiently, improve decision-making processes, transparency and accountability.
https://openbudget.gov.ua/analytics/incomes 
https://openbudget.gov.ua/ 

The National Health Service of Ukraine (NHSU) is the central executive body that implements the state policy in the field of state financial guarantees of medical care. The NHSU uses the principle ""money follows the patient"" and uses  the open data and the dashboards on its basis for financial spending during the COVID 19 pandemic. The open data and dashboards provide information on testing and inpatient treatment of patients with COVID-19, list of healthcare providers designated to provide inpatient care to patients with COVID-19 under an agreement with the National Health Insurance Fund, statistics of keeping medical records on vaccination of the population. This data is used on daily basis for decision-making processes by Cabinet of Ministers, Ministry of the Health and NHSU in fight against pandemic 

Project https://nszu.gov.ua/e-data/dashboard/likarni-covid 
https://nszu.gov.ua/e-data/dashboard/covid-drugs-inventory 
https://nszu.gov.ua/e-data/dashboard/covid-package-stat 
";;;;;15
;2.3b Social impact;;;;;;;80
ID;Question;Answer;Justification;Guide to Answering;Reviewer 1 Comments;Reviewer 2 Comments;Mark Question;Score
45;"Is any data on the impact created by open data on social challenges (e.g. inequality, healthcare, education) available in your country? 

For justification:
* If yes, please specify what kind of data proves this impact and provide the URLs to this data.";yes;"The report of open data impact on the healthcare in Ukraine is available via link https://data.gov.ua/uploads/files/2022-10-03-123908.651661Healthcare-OD-impact-study.pdf  The Ministry of Digital Transformation of Ukraine conducted a study on the impact of data discovery in the field of health care on society.
The study collects examples of the use of open data and analyzes how they help Ukrainians in solving medical problems. In particular, the report analyzes whether it is possible to save money when buying drugs, how to get drugs for free at your hospital, how to understand the process of signing declarations with doctors, what changes are taking place in the health care system and where the budget goes. https://diia.data.gov.ua/value/health
Open data in the medical field helps solve a number of problems in the context of low awareness of the above issues, in particular:
Open data published by the NHSU promotes transparency in the functioning of the institution and allows anyone to check the accuracy of information about the activities of the NHSU and the course of healthcare reform.
With the help of interactive services and products created on the basis of open data in the medical field, citizens receive information on signing declarations with physicians in a clear and informative format.
Creating services based on open data helps attract citizens and pharmacies to the Affordable Medicine program, providing the following information in an accessible and efficient format: to patients about the availability of medicines that can be received on a free-of-charge basis, to pharmacy owners about the location of participating pharmacies,
the level of competition in the market and the amount of payments to pharmacies and, accordingly, the analysis of opportunities to participate in the program. Informing about the results of health care reform, based on real data, stories and examples, has a positive effect on the attitude of the population to the reform and on the assessment of the state of affairs in the field as a whole ";The social impact is hereby defined as the beneficial effect of the use of open data on four specific challenges for society: 1) Including minorities, migrants, and/or refugees  and reducing inequality, 2) Alleviating housing issues, 3) Fostering health and wellbeing, 4) Improving education.;;;;20
46;"Is the use of open data in your country having an impact on society´s ability to reduce inequality and better include minorities, migrants, and/or refugees (e.g. from the Ukrainian war)? 

For justification:
* If yes, please explain how and what kind of impact is created on the topic and provide examples of maximum 3 recent open data reuse cases in the form of research or application, whether developed by government or by civil society.";yes;"Visualizations and analytical panels are used by the authorities to better plan policies to protect vulnerable social groups and ensure equal rights and opportunities for all, including the protection of basic fundamental rights.

A City for Everyone Visualization Tool for Zaporizhia City 
A City for Everyone utilizes data on buildings accessibility for persons with disabilities (PWD).
While researching the accessibility of buildings in Zaporizhia, and help to fight again several corruption risks, including inconsistency between the actual state of buildings’ accessibility and what is documented in the inspection results; inconsistency between planned and actual works performed to improve accessibility and the city’s actual needs; and approval of projects and commissioning of buildings with facilities that do not meet state accessibility standards.  This tool will greatly reduce or prevent potential corruption violations that can occur at each stage of the budget management cycle: approval of project documentation (e.g., non-compliant projects); selection of contractors (e.g., selection of affiliates); and acceptance of works (e.g., work that fails to meet project standards, which include state accessibility standards).
Project : https://texty.org.ua/d/2021/zaporizhzhia_inclusive/ 
Data https://data.gov.ua/dataset/bd9a85a7-610d-40ed-962b-bb1cf509d796 ";;;;;15
47;"Is the use of open data in your country having an impact on the society´s level of awareness concerning housing in urban areas? 

For justification:
* If yes, please explain how and what kind of impact is created on the topic and provide examples of maximum 3 recent open data reuse cases in the form of research or application, whether developed by government or by civil society.";yes;"According to the order ""On the approval of the Procedure for placement of temporary structures for conducting business activities"", the basis for placement of temporary structures is the permits issued by the executive bodies of village, settlement, and city councils. However, not all entrepreneurs comply with the requirements of the law and the current rules for the placement of temporary structures. So, for example, 4,500 illegally installed temporary structures were removed in Kyiv in 2020. However, according to various estimates, from six to seven thousand IAFs are still working illegally in Kyiv. Non-receipt of taxes for unaccounted-for constructions, as well as costs for their dismantling, are millions of hryvnias lost to local budgets. An excessive number of structures spoils the appearance of the city, they can interfere with the movement of pedestrians and pose a danger to all road users. The interactive map of temporary structures of the Rivne City Council https://arhrv.gov.ua/map/temp is a tool that allows you to easily determine the legal status of all temporary structures in Rivne. Thanks to this map, every resident can find out in a few clicks whether this or that kiosk is legally installed. The project is based on open data with a list of permits for the placement of temporary structures, which makes it possible to quickly monitor changes in the status of each specific object and respond to cases of violations of the law. The map is part of the Rivne geoportal, where, among other things, there are eight interactive maps that, in addition to the issue of temporary structures, also cover the zoning plan, the street register, passenger transport, and more. The interactive map of the temporary structures of the Zhytomyr City Council https://gis.zt-rada.gov.ua/ was created on the basis of the Zhytomyr geoportal, which contains a map of the city's temporary structures. Passports of temporary structures are also available for downloading and viewing on the site, and a convenient search and filtering system has been created for familiarization with the necessary data. Among other things, more than ten different formats are available on the portal, including visualization and data sets for communal property, register of advertising media, cadastral map, etc.";Data that provides information on the housing market, rental market, property valuations, sales, planning, zoning, census data on socio-economic variables for cities and/or neighbourhoods, other housing issues such as homelessness, empty dwellings, gentrification.;;;;15
48;"Is the use of open data in your country having an impact on the society´s level of awareness on health and wellbeing related issues (also but not only in light of the COVID-19 pandemic)? 

For justification:
* If yes, please explain how and what kind of impact is created on the topic and provide examples of maximum 3 recent open data reuse cases in the form of research or application, whether developed by government or by civil society.";yes;"https://toolkit.data.gov.ua/c7/medicine.html Find out which medicines can be obtained free of charge during hospitalization, and check their availability at the medical institution. If you are receiving inpatient treatment, the medical institution must provide you with drugs included in the National List of Essential Medicines free of charge. But there may be cases when doctors either hide this right from patients, or say that the necessary drugs are not available, and patients have to buy the drugs themselves. With the help of open data, you can protect your rights by checking which drugs are guaranteed by the state and whether they are available in the medical institution. To find out whether the hospital has drugs that should be provided free of charge, you can use the analytical module from the State Enterprise ""Medical Procurement"" https://bi.medzakupivli.com/ or the ""E-MEDICINES"" https://eliky.in.ua/ service. The data of the latter is available for use through АРI. Map of pharmacies participating in the ""Affordable Medicines"" program from the data journalism agency Texty.org.ua https://texty.org.ua/d/2019/medical_reform/#/apteky ""Will be mother"" chat bot. This is a specialized service for pregnant women, developed on the basis of open data. It contains a step-by-step algorithm on how to get free pregnancy support, medical care during childbirth and neonatal services. Thanks to the chatbot, women planning pregnancy will find all the necessary information about their rights and state-guaranteed services https://t.me/IWillBeMother_bot ";;;;;15
49;"Is the use of open data in your country having an impact on the society´s level of education and skills (e.g. data literacy)?

For justification:
* If yes, please explain how and what kind of impact is created on the topic and provide examples of maximum 3 recent open data reuse cases in the form of research or application, whether developed by government or by civil society.";yes;"The development of open data in Ukraine has a significant impact on improving the level of knowledge and skills of the population in the field of data use and handling. This applies to both the use of ready-made products based on open data and the creation of their own. And directly increase the level of knowledge and awareness of the general public about the possibilities of using open data.

Re-use cases based on open data and applications: How to know who is financing a political party? https://toolkit.data.gov.ua/c1/policy-funding.html  How to find undeclared property of state servants? https://toolkit.data.gov.ua/c2/undeclared-property.html How to find bussines owner? https://toolkit.data.gov.ua/c3/business-owner.html How to find out is company has all nessecery licens https://toolkit.data.gov.ua/c3/license.html How open data helps during the war https://diia.data.gov.ua/info-center/yak-vidkriti-dani-dopomagayut-ukrayincyam-pid-chas-vijni How to use open data in time of cyber war? https://diia.data.gov.ua/info-center/yak-povoditisya-v-kiber-ta-infoprostori-v-umovah-vijni";;;;;15
;2.3c Environmental impact;;;;;;;80
ID;Question;Answer;Justification;Guide to Answering;Reviewer 1 Comments;Reviewer 2 Comments;Mark Question;Score
50;"Is any data on the impact created by open data on environmental challenges (e.g. climate change and environmental degradation, as highlighted in the Eurpean Green Deal) available in your country? 

For justification:
* If yes, please (1) specify what kind of data proves this impact and (2) provide the URLs to this data. ";yes;"The report on the open data impact on environmen protection is available via link https://data.gov.ua/uploads/files/2022-10-03-123559.380394Ecology-OD-Impact-Study-1.pdf The issue of environmental pollution is important for 93% of Ukrainians. Government agencies have opened dozens of registers in the field of ecology: data on the quality of surface water, licenses for hazardous waste management, permits for air emissions, subsoil use and special water use, and many others.
Publication of state data on the portal in free access is the first step. The data should be easy to understand even for non-specialists. Therefore, based on these data, developers create user-friendly services that make it easier for citizens to find information about the state of the environment, the presence of pollutants and potentially dangerous objects that can affect their health, habitat and other areas of life https://diia.data.gov.ua/value/ecology

Responce to reviewer:
The report discribes practical cases of open data usage on public control over compliance by enterprises environmental legislation, public air quality and water pollution monitoring, fight against illegal landfills and fighting fires in the ecosystems of Ukraine.

Also toolkit on environmental Open Dsta usage is developed. It helps to find appropriate service to solve a problem, to fsnd out what exactly you can solve with open data. https://toolkit.data.gov.ua/c4/environment.html";The environmental impact is hereby defined as the beneficial effect of the use of open data on four specific challenges connected to the environment: 1) Protecting biodiversity (e.g. maintaining a good level of air and water quality), 2) Achieving more environmental-friendly cities (e.g. in terms of transport and waste management), 3) Fighting climate change and connected disasters, 4) Increasing the use of renewable sources of energy.;;The current answer focuses on making relevant datasets available. This is important, but impact comes from the use of the datasets. Does the study mention any impact already created by open data?;;20
51;"Is the use of open data in your country having an impact on the level of protection of biodiversity (e.g. maintaining a good air and water quality)? 

For justification:
* If yes, please explain how and what kind of impact is created on the topic and provide examples of maximum 3 recent open data reuse cases in the form of research or application, whether developed by government or by civil society.";yes;"Monitoring of surface water pollution
The Clean Water and Open Environment tools, which use data from the State Water Resources Agency, will help check water quality. They provide information on the indicators of pollution of the largest river basins of Ukraine. Clean Water also contains a list of companies that pollute rivers in each region and the extent of that pollution.

Air quality monitoring
Services SaveEcoBot, CityScale, EcoCity, LUN City Air, EcoInfo integrate open data of the Ministry of Environmental Protection and Natural Resources with data from public monitoring networks on air pollution. This combination allows companies to monitor emissions of hazardous substances and justifiably require environmental investments in case of significant pollution, and residents - to avoid being outdoors during hazardous air pollution or choose housing in areas with less polluted air.              

Re-use cases 
SaveEcoBot https://www.saveecobot.com , EcoCity https://eco-city.org.ua/ , LUN City Air https://misto.lun.ua/air , EcoInfo https://ecoinfo.pro integrate open data of the Ministry of Environmental Protection and Natural Resources with data from public monitoring networks on air pollution to monitor emissions of hazardous substances and reasonably require environmental investments in case of significant pollution, and residents - to avoid being outdoors during hazardous air pollution or to choose housing in an area with less polluted air. The impact of the cases are described in the research on the anti-corruption and social impact of open data in the environmental sphere of Ukraine and products based on their use 

“Battle for water. How global warming affects the agricultural south of Ukraine” project has a feature - a map where it's possible to look for companies and check where they get its water or extract it from underground deposits. 
Project https://texty.org.ua/projects/102645/bytva-za-vodu-yak-hlobalne-poteplinnya-vplyvaye-na-ahrarnyj-pivden-ukrayiny/ 
Data https://data.gov.ua/dataset/water-use-permits ";;;;;15
