ID;Question;Answer;Justification;Guide to Answering;Reviewer 1 Comments;Reviewer 2 Comments;Mark Question;Score
;;;;;;;Total Score:;2443
;;;;;;;Unsure Score:;0
;;;;;;;"Preliminary Score: 
(Total - Unsure)   ";2443
;Respondent Information;;;;;;;
;Please provide written information to the question in `Justification` column. Where applicable, select an answer option from the drop-down options in the `Answer` column. ;;;;;;;
;0.1 Background information;;;;;;;
ID;Question;Answer;Justification;Guide to Answering;Reviewer 1 Comments;Reviewer 2 Comments;Mark Question;Score
R1;What is your country?;N/A;Ukraine;;;;;N/A
R2;What is your organisation?;N/A;Ministry of Digital Transformation of Ukraine;;;;;N/A
R3;What is your name?;N/A;xxx;;;;;N/A
R4;What is your position/role?;N/A;xxx;;;;;N/A
R5;What is your email address?;N/A;xxx;;;;;N/A
R6;What is the size of national open data team (core team members);N/A;3;;;;;N/A
R7;How many FTE(s) are in the national open data team?;N/A;More than 40 working hours per week;;;;;N/A
R8;What is the annual budget of the national portal?;<200.000 EUR;N/A;This is the annual budget for all portal activities (portal development and maintenance, promotion and awareness-raising activities) of the national portal. This should include the budget for the national portal team, whether an internal team or external contractors.;;;;N/A
;0.2 data.europa.eu and national open data portals;;;;;;;
ID;Question;Answer;Justification;Guide to Answering;Reviewer 1 Comments;Reviewer 2 Comments;Mark Question;Score
R9;"Are you satisfied with data.europa.eu as a European single point of access?

For Justification:
* If you selected 'yes', what do you consider particularly good about data.europa.eu as European single point of access? 
* If you selected 'no', how would you improve data.europa.eu as European single point of access? ";yes;data.europa.eu is good as a European single point of access tu public information and open datasets because it is a complete source of information about all activities about open data in Europe. In addition, UX/UI of data.europa.eu is clear and pleasant to work with.;;;;;N/A
R10;"Does the portal data.europa.eu reflect the data that your national portals hosts? 

For Justification:
* If you selected 'no' or 'partially', how would you improve data.europa.eu to better reflect the data on national open data portals like the one in your country?";yes;;;;;;N/A
;Dimension 1: Open Data Policy;;;;;;;625
;"Please note that this section differentiates between open data policy and open data strategy. Policy here refers to all principles/initiatives set out to achieve the goals established by the Open Data Directive, including specific national legislation put in place to transpose the EU law. With strategy, on the other hand, we define a document outlining the concrete vision, mission, objectives, measures to be implemented, timeline and responsible. An open data strategy would ideally include information on the open data governance structure and operating model.

Please select the answer from the drop down options in the `Answer` column. If applicable, please provide additional information to justify the selected answer in the `Justification` column.                                                                                                                                                                                                                                                                                                                                                                                        ";;;;;;;
;1.1 Policy framework;;;;;;;260
ID;Question;Answer;Justification;Guide to Answering;Reviewer 1 Comments;Reviewer 2 Comments;Mark Question;Score
1;"Is there a national open data policy in your country and does this include a national legislation for the transposition of the Open Data Directive (if your country is an EU Member State)?

For Justification:
* If yes, please provide (1) the URL and (2) title of the policy document and briefly describe.
* If ‘other’, please provide (1) a brief explanation to support your answer choice and (2) provide the URL and indicate the policy section which explicitly references open data.";yes;"The policy of open data in Ukraine includes the following basic documents that regulate open data sphere:
Law of Ukraine ""On Information"" https://zakon.rada.gov.ua/laws/show/2657-12#Text 
The law defines the basic principles of access to information, and establishes the categorization of information that is in the possession of state bodies                                                                                                                                                                                       The Law of Ukraine ""On Access to Public Information"" https://zakon.rada.gov.ua/laws/show/2939-17#Text  which contains a separate article on open data, and establishes the general principles of access to public information.
Resolution of the Cabinet of Ministers of Ukraine dated October 21, 2015 No. 835 ""On approval of the regulation on data sets that are subject to publication in the form of open data"" https://zakon.rada.gov.ua/laws/show/835-2015-%D0%BF#Text 
The regulation defines the procedure for publishing  open data, requirements for its metadata, and a list of sets of data that must be published in the form of open data.
In addition, the provision contains implemented principles of the International Open Data Charter                                                                                                                                                                                                                                    Resolution of the Cabinet of Ministers of Ukraine dated November 30, 2016 No. 867 ""Some issues of public information disclosure in the form of open data"" https://zakon.rada.gov.ua/laws/show/867-2016-%D0%BF#Text The regulation contains basic information about the functioning of the national open data portal, and the obligations of data providers in working with portal
Decree of the Cabinet of Ministers of Ukraine dated September 22, 2016 No. 686-r ""Some issues of joining the International Open Data Charter"" https://zakon.rada.gov.ua/laws/show/686-2016-%D1%80#Text Decree establishes Ukraine's accession to the International Open Data Charter and imposes an obligation on data providers to use the principles of the charter during the process of publishing datasets
The implementation of Directive 2019/1024/EU regarding open data was carried out in 2021 with the adoption of Resolution No. 407 of the Cabinet of Ministers of Ukraine dated March 3, 2021 ""On Amendments to Resolutions No. 835 and No. 30 of the Cabinet of Ministers of Ukraine dated October 21, 2015 November 2016 No. 867""";The answer option 'Other' should be selected by countries that do not have a specific open data policy in place but have a national policy (on data, digitalisation, artificial intelligence, eGovernment or similar) that explicitly includes open data in its text and scope.;;;;30
2;"Is there a national open data strategy in your country?

For Justification:
* If yes, please provide (1) the URL to the strategy and (2) describe the main highlights.  
* If 'not applicable', please provide (1) a brief explanation to support your answer choice and provide (2) the URL and indicate the policy section which explicitly references objectives, actions/measures, delivery timelines etc.";yes;"In January 2022, Ukraine developed a strategy for the development of open data until 2025. Link to strategy https://data.gov.ua/uploads/files/2022-06-15-102752.7196282150222.pdf 
However, due to the large-scale military invasion of Russia on February 24, 2022, the Strategy wasn`t approved at the level of the Cabinet of Ministers of Ukraine, its official approval was postponed until Ukraine's victory in the war.
At the same time, the main provisions of the draft strategy for the development of open data in Ukraine were reflected in other strategic documents of the Government, including those adopted in response to Russia's armed aggression.
Among them: Plan for the recovery of Ukraine https://recovery.gov.ua/en/project 
The Government's priority action plan for 2023 https://zakon.rada.gov.ua/laws/show/221-2023-%D1%80#Text https://zakon.rada.gov.ua/laws/file/text/104/f524487n15.docx 
National strategy for promoting the development of civil society in Ukraine for 2021-2026 https://zakon.rada.gov.ua/laws/show/487/2021#Text 
Anti-corruption strategy for 2021-2025 https://zakon.rada.gov.ua/laws/show/2322-20#Text 
State strategy of regional development for 2021-2027 https://zakon.rada.gov.ua/laws/show/695-2020-%D0%BF#Text                    All of the strategies and action plans listed above contain separate sections on open data.
First of all, they concern the intensification of the publication of open data, the use of machine-readable formats and the support of transparency and accountability of authorities, which is necessary for the development of civil society. In addition, all strategies in one way or another encourage the reuse of open data by both the public and private sectors";The answer option 'Not applicable' can be selected if e.g. there is no specific strategy in place, but the existing policy refers to the objectives, actions/measures to be implemented, delivery timelines, responsible etc. Should another explanation apply in your case, please provide it in the justification text box.;;;;30
3;"Has this national strategy/policy been updated in the past 24 months?

For Justification:
* If yes, please briefly describe the main changes. ";yes;All government policy documents, including those related to open data and civil society development, have undergone changes over the past 12 months. first of all, it is connected with the challenges that appeared before the Ukrainian society in connection with the war. The main changes in open data strategies relate to the balance between access to public information and ensuring the interests of Ukraine's national security and defense. Moreover, the main regulatory legal acts, which refer to the list of data sets that must be published by the authorities, are constantly updated and expanded, the last such change took place in January 2023. https://zakon.rada.gov.ua/laws/show/2322-IX#Text https://www.kmu.gov.ua/storage/app/sites/1/recoveryrada/eng/digitization-eng.pdf https://zakon.rada.gov.ua/laws/show/220-2023-%D0%BF#Text   ;;Are there any URLs available to these documents?;;;10
4;"Is there any further open data policy/strategy at regional or local level?

For Justification:
* If yes, please (1) provide the URL and (2) title of the document(s) and (3) briefly describe.";yes;"Lviv https://www8.city-adm.lviv.ua/Pool/Info/doclmr_1.NSF/(SearchForWeb)/7676F23B77FA4D95C22581790030B9C7?OpenDocument                                                                                                                                                                            
Vinnytsya http://www.vmr.gov.ua/Docs/MajorOrdersR/2017/%E2%84%96181-%D1%80%2018-10-2017%20%D0%9F%D1%80%D0%BE%20%D0%B7%D0%B0%D1%85%D0%BE%D0%B4%D0%B8.pdf 
Ternopil https://ternopilcity.gov.ua/normative-documents/vidkriti-dani/28627.html                                                                                                                                                                                                                                                                                                                                                           
The key points of such strategy are                                                                                                                                                                           Development, adoption, improvement of the internal regulatory framework, such as provisions on open data, job descriptions, procedures and maintenance and publication of registers, etc.
Information audit of data sets, creation of the register of data sets of the information manager.
Improving the skills of employees in the publication and use of data in training, courses, programs.
Establishment of a structural subdivision (department, sector) or position in the field of open data.
Modernization of information systems for data export in open machine-readable formats CSV, JSON, XML, creation of open APIs (application programming interfaces) for publishing sets.
Establishment and strengthening of information exchange between structural subdivisions and with other authorities.
Development of electronic services, analytical dashboards, chatbots and other products based on open data.
Consulting and establishing partnerships with business and the public to open new sets, improve data quality.
Introduction of own open data portal.
Promotion of open data: holding hackathons, competitions for projects based on open data.";;;;;10
5;"Does the national strategy/policy include an action plan with measures to be implemented in the open data field?

For justification:
If yes, please briefly describe the main measures described by the action plan.";yes;"Action plan for implementation of open data strategy is available via link https://data.gov.ua/uploads/files/2022-06-15-120043.7877993140222-1.pdf The key-points of action plan are: 1. Disclosure in the form of open data of all available public information (implementation of the principles ""open by default"" and ""open by design"") 2. Increasing the level of reuse of public information in the form of open data 3. Compliance of the datasets published on the National Portal with the principles International Open Data Charter";;;;;25
6a;"Does the national strategy/policy outline measures to incentivise the publication of and access to real-time or dynamic data?

For justification:
* If yes, please briefly describe the measures.";yes;"The strategy envisages measures to increase the level of publication and use of dynamic data
This is done by ensuring the disclosure of dynamic datasets at the time of creation with all the elements necessary for their reuse, which includes:
empowering the central executive body that formulates policies in the field of open data to approve the list of dynamic datasets and to set requirements for the deadline for publication of such datasets
organization by managers of access to dynamic data sets in real time exclusively through application programming interfaces (API) in accordance with the requirements of the legislation on their content, available elements, etc. (paragraph 7 page 11) https://data.gov.ua/uploads/files/2022-06-15-102752.7196282150222.pdf ";Dynamic data is data that changes asynchronously over time is periodically updated, as new information becomes available. Real-time data is data that changes and needs updating at very frequent intervals, in most cases several times a minute. Access to dynamic and/or real-time data is most commonly provided via application programming interfaces (APIs). Plase note that real-time data is not the same as dynamic data. Real-time data can be dynamic (e.g. a variable indicating current location) or static (e.g. a fresh log entry indicating location at a specific time). ;;;;15
6b;"Does the national strategy/policy outline measures to incentivise the publication of and access to geo-spatial data (e.g. in relation to high-value datasets as specified in the implementing regulation (EU) 2023/138)?

For justification:
* If yes, please briefly describe the measures.";no;The Ministry continues work on the development of standards (requirements) for the publication of high-value datasets. Standards for datasets containing geospatial data are being developed. However, such activity is not foreseen by the current action plans for the development of open data. The work is carried out in accordance with the requirements of the legislation of Ukraine,  Resolution of the Cabinet of Ministers dated October 21, 2015 No. 835 (amended);"Geo-spatial data is data that contains information on properties that are linked to a position on earth. 

The implementing regulation (EU) 2023/138, adopted in December 2022 and published in January 2023 by the European Commission, lays down a list of specific high-value datasets and the arrangements for their publication and re-use. https://eur-lex.europa.eu/legal-content/EN/TXT/?uri=CELEX%3A32023R0138";"Last year's answer mentioned measures on geospatial data. Is this still relevant this year? Has there been progress on these?

""The strategy envisages the creation of requirements (standards) for the publication of high-value datasets, which also include geospatial datasets.

This applies in particular to those datasets that are not inherently geospatial but contain some cartographic information, or may be enriched by it. (paragraphs 1-5 page 10) https://data.gov.ua/uploads/files/2022-06-15-102752.7196282150222.pdf  (https://drive.google.com/file/d/1SAQD4qxrMqgH5BY_reZkHLrvMZGzCm5f/view?usp=sharing)""";;;0
6c;"Does the national strategy/policy outline measures to incentivise the publication of and access to citizen-generated data?

For justification:
* If yes, please briefly describe the measures.";yes;"The Law of Ukraine on ""Access to Public Information"" provides for the possibility of publishing information provided by individuals or legal entities under private law.

However, if a natural or legal person under private law is a provider of information of significant public interest or concerns the environment, protection of life and health of citizens - such publication is mandatory. NGO ""Save Dnipro"" publish its own data on the National portal https://data.gov.ua/organization/9b012670-b499-4923-a3c9-4c23f1d86f8f";Citizen-generated data is the data that people or their organisations produce to directly monitor, demand or drive change on issues that affect them.;;;;15
6d;"Does the national strategy/policy foster the discoverability of the aforementioned types of data from your country on data.europa.eu?

For justification:
* If yes, please briefly describe how.";yes;From 2018, datasets from the national portal are harvested by the European Open Data Portal automatically https://data.europa.eu/data/datasets?locale=en&catalog=data-gov-ua&page=1  Ukraine's open data policy promotes unification of datasets and its interoperability with other datasets;;;;;10
7;"Does the national strategy/policy outline measures to support the reuse of open data by the public sector?

For justification:
* If yes, please briefly describe the measures.";yes;"Decree 835 establishes among other things Principles For Improved Governance & Citizen Engagement and For Inclusive Development & Innovation. The last is defined as granting by information providers support and assistance in creating new information resources and services based on public information in the form of open data. It also sets definition of a term ""permanent applicability"" - ensuring the use of public information in the form of open data by public authorities and local governments in the exercise of their powers.
Realization of the Principle For Improved Governance & Citizen Engagement of Open Data Strategy provides for:
Promotion of the use of the open data by public bodies;
Cooperation with NGOs and business  on the creation and promotion of visualizations, tools and analytical materials based on open data;
Promotion of the development of skills in the use of open data by NGOs and other civil society organisations;
Organization of informational and educational activities for the leadership of public authorities and local governments on the development of the effective open data programs in their government bodies.
One of the goals of new Open Data Strategy  is the high level of re-use of public information in the form of open data, which also includes re-use of open data by the public sector";These measures should promote concepts such as data-driven government, policy-making and decision-making.;;;;15
8;"Does the national strategy/policy outline measures to support the reuse of open data by the private sector?

For justification:
* If yes, please briefly describe the measures.";yes;"One of the goals of new Open Data Strategy is the high level of re-use of public information in the form of open data, which also includes re-use of open data by the private sector. It will include the following subgoals: the functionality of the Portal allows ordinary users to use its capabilities having basic technical skills; the Portal has implemented several channels of user interaction with information providers and the holder of the Portal; dynamic data, which is in high demand in society, is updated at the time of creation and measures to achieve those subgoals.
Also as a measure to support the re-use of open data by priviate sector is the online course Open Data for Business that was created on the national platform of the digital education - https://osvita.diia.gov.ua/courses/opendata";These measures could promote concepts such as smart cities and/or regions, but also new business development (in particular Small - and Medium-sized Enterprises), entrepreneurship etc.;;;;15
9a;"Does the national strategy/policy mandate carrying out and maintaining a data inventory by public bodies, whether at national or local level?

For justification:
* If yes, please briefly specify.";yes;"According to legislation, all public bodies must publish the result of data inventory on data.gov.ua. 
Legislation establishes the definition of the term ""information audit"" - the process of analysis by the information provider on the availability, status, formats, management processes and use of all information in his possession. An information audit is mandatory and is performed at least once a year.
The methodology of information audit is approved by the central executive body, which ensures the formation and implementation of state policy in the field of open data - Ministry of Digital Transformation.
The results of the information audit of the information provider are subject to mandatory publication on the National portal as a separate dataset.                                                                                                                                                                                                                  One of the modules of the Open Data for Civil Servants curriculum is devoted exclusively to the methodology of auditing open data, which is mandatory for all data providers and should be conducted at least once a year. more than 18,000 civil servants successfully completed the training program in 2020-2021";A data inventory is a comprehensive catalogue of datasets held by an organisation.;;;;15
9b;"If yes [in Q9a], do these data inventories also include the data collected by public bodies that cannot be published as open data (e.g. in relation to the EU Data Governance Act (EU) 2022/868)? 

For justification:
* If yes, please briefly specify.";yes;"In accordance with the legislation, information providers shall perform information audit of all information in their possession - both that can be published as open data and vice versa.
Moreover, due to the ""open by default principle"", all public information is open. It means, that though containing, for example, personal data, dataset shall nevertheless be published as open data with anonymisation of such personal data.";The Data Governance Act (EU) 2022/868 seeks to increase trust in data sharing, strengthen mechanisms to increase data availability and overcome technical obstacles to the reuse of data. It also aims to support the set-up and development of common European data spaces in strategic domains, involving both private and public players, in sectors such as health, environment, energy, agriculture, mobility, finance, manufacturing, public administration and skills. The Data Governance entered into force on 23 June 2022 and, following a 15-month grace period, will be applicable from September 2023. https://eur-lex.europa.eu/legal-content/EN/TXT/?uri=CELEX%3A32022R0868;;;;10
10a;"Has your country started working towards the application of the implementing regulation (EU) 2023/138 on high-value datasets?

For Justification:
* If yes, how is it progressing? 
* If you are an EFTA or a candidate country to the EU, please select 'not applicable'.
** In the table below, please indicate your progress with respect to a) organisation, b) legal aspects, c) technical aspects on a scale from 1 to 5. 1 = no progress; 2 = few progress; 3 = some progress; 4 = considerable progress; 5 = works are finalised.
";yes;N/A;The implementing regulation (EU) 2023/138, adopted in December 2022 and published in January 2023 by the European Commission, lays down a list of specific high-value datasets and the arrangements for their publication and re-use. https://eur-lex.europa.eu/legal-content/EN/TXT/?uri=CELEX%3A32023R0138;"Kindy fill in the column ""Publications of HCD in machine-readable formats via APIs"" in the table below. This column was hidden in the original questionnaire. Sorry.";;;20
;Categories of high-value datasets;;;Degree of progress (from 1 to 5);;;;
;;Organisational progress;Legal progress ;;Technical progress ;;;
;;Setting up new roles and workflows;Addressing legal barriers;Identification and inventory of high-value datasets;Publication of high-value datasets in machine-readable formats via APIs;Standardised means to structure, describe, access high-value datasets;Ensuring metadata availability and quality;
;Geospatial;2;4;3;3;3;3;
;Earth observation and environment;3;4;3;3;3;3;
;Meteorological;1;4;2;2;2;2;
;Statistics;4;4;4;4;4;4;
;Companies and company ownership;4;4;4;4;4;4;
;Mobility;1;3;2;2;2;2;
